"PMID";"Method";"Search_Term";"Journal";"Citations";"YearPubmed";"Title";"Abstract"
"24831181";"UMI";"UMI";"Computerized medical imaging and graphics : the official journal of the Computerized Medical Imaging Society";1;2014;"Multispectral band selection and spatial characterization: Application to mitosis detection in breast cancer histopathology.";"Breast cancer is the second most frequent cancer. The reference process for breast cancer prognosis is Nottingham grading system. According to this system, mitosis detection is one of the three important criteria required for grading process and quantifying the locality and prognosis of a tumor. Multispectral imaging, as relatively new to the field of histopathology, has the advantage, over traditional RGB imaging, to capture spectrally resolved information at specific frequencies, across the electromagnetic spectrum. This study aims at evaluating the accuracy of mitosis detection on histopathological multispectral images. The proposed framework includes: selection of spectral bands and focal planes, detection of candidate mitotic regions and computation of morphological and multispectral statistical features. A state-of-the-art of the methods for mitosis classification is also provided. This framework has been evaluated on MITOS multispectral dataset and achieved higher detection rate (67.35%) and F-Measure (63.74%) than the best MITOS contest results (Roux et al., 2013). Our results indicate that the selected multispectral bands have more discriminant information than a single spectral band or all spectral bands for mitotic figures, validating the interest of using multispectral images to improve the quality of the diagnostic in histopathology."
"24762816";"UMI";"UMI";"PLoS neglected tropical diseases";1;2014;"Reproductive status of Onchocerca volvulus after ivermectin treatment in an ivermectin-naïve and a frequently treated population from Cameroon.";"BACKGROUND: For two decades, onchocerciasis control has been based on mass treatment with ivermectin (IVM), repeated annually or six-monthly. This drug kills Onchocerca volvulus microfilariae (mf) present in the skin and the eyes (microfilaricidal effect) and prevents for 3-4 months the release of new mf by adult female worms (embryostatic effect). In some Ghanaian communities, the long-term use of IVM was associated with a more rapid than expected skin repopulation by mf after treatment. Here, we assessed whether the embryostatic effect of IVM on O. volvulus has been altered following frequent treatment in Cameroonian patients.METHODOLOGY: Onchocercal nodules were surgically removed just before (D0) and 80 days (D80) after a standard dose of IVM in two cohorts with different treatment histories: a group who had received repeated doses of IVM over 13 years, and a control group with no history of large-scale treatments. Excised nodules were digested with collagenase to isolate adult worms. Embryograms were prepared with females for the evaluation of their reproductive capacities.PRINCIPAL FINDINGS: Oocyte production was not affected by IVM. The mean number of intermediate embryos (morulae and coiled mf) decreased similarly in the two groups between D0 and D80. In contrast, an accumulation of stretched mf, either viable or degenerating, was observed at D80. However, it was observed that the increase in number of degenerating mf between D0 and D80 was much lower in the frequently treated group than in the control one (Incidence Rate Ratio: 0.25; 95% CI: 0.10-0.63; p = 0.003), which may indicate a reduced sequestration of mf in the worms from the frequently treated group.SIGNIFICANCE: IVM still had an embryostatic effect on O. volvulus, but the effect was reduced in the frequently treated cohort compared with the control population."
"24755264";"UMI";"UMI";"Global health promotion";1;2014;"[Community campaigns to promote HIV testing and counseling in West Africa: Perceptions of users in Burkina Faso].";""
"24705410";"UMI";"UMI";"PloS one";1;2014;"Low birth weight in perinatally HIV-exposed uninfected infants: observations in urban settings in Cameroon.";"BACKGROUND: The consequences of maternal HIV infection for fetal growth are controversial. Here, we estimated the frequency of small for gestational age and gender (SGAG) among neonates born to HIV-infected or uninfected mothers and assessed the contribution, if any, of maternal HIV to the risk of SGAG.METHODS: The data used were obtained from the ANRS-Pediacam cohort in Cameroon. Pairs of newborns, one to a HIV-infected mother and the other to an uninfected mother, were identified during the first week of life, and matched on gender and recruitment site from 2007-2010. SGAG was defined in line with international recommendations as a birth weight Z-score adjusted for gestational age at delivery and gender more than two standard deviations below the mean (-2SD). Considering the matched design, logistic regression modeling was adjusted on site and gender to explore the effect of perinatal HIV exposure on SGAG.RESULTS: Among the 4104 mother-infant pairs originally enrolled, no data on birth weight and/or gestational age were available for 108; also, 259 were twins and were excluded. Of the remaining 3737 mother-infant pairs, the frequency of SGAG was 5.3% (95%CI: 4.6-6.0), and was significantly higher among HIV-infected infants (22.4% vs. 6.3%; p&lt;.001) and lower among HIV-unexposed uninfected infants (3.5% vs. 6.3%; p&lt;.001) than among HIV-exposed uninfected infants. Similarly, SGAG was significantly more frequent among HIV-infected infants (aOR: 4.1; 2.0-8.1) and less frequent among HIV-unexposed uninfected infants (aOR: 0.5; 0.4-0.8) than among HIV-exposed uninfected infants. Primiparity (aOR: 1.9; 1.3-2.7) and the presence of any disease during pregnancy (aOR: 1.4; 1.0-2.0) were identified as other contributors to SGAG.CONCLUSION: Maternal HIV infection was independently associated with SGAG for HIV-exposed uninfected infants. This provides further evidence of the need for adapted monitoring of pregnancy in HIV-infected women, especially if they are symptomatic, to minimize additional risk factors for SGAG."
"24683017";"UMI";"UMI";"Bulletin de la Société de pathologie exotique (1990)";1;2014;"Perceptions of lipodystrophy among PLHIV after 10 years of antiretroviral therapy in Senegal.";"Nearly one-third of people living with HIV (PLHIV) and taking HAART develop lipodystrophy in Africa. This article aims to describe how they perceive these disorders and the determinants of these perceptions. It is based on a qualitative study using interviews conducted with 20 patients with clinical lipodystrophy in Dakar, Senegal. Not all of the interviewees complained, though some had clearly visible lipodystrophy. The hypertrophic form seems better tolerated when perceived as overweight, a sign of excess wealth. Atrophic forms sometimes go unnoticed in lean people, but others experience it as stigma, avoid appearing in public, and express significant suffering, especially when symptoms jeopardize their social status. Healthcare systems should take better account of lipodystrophy and its psychosocial effects because they weaken adherence and reduce patients' quality of life."
"24666571";"UMI";"UMI";"Journal of evolutionary biology";1;2014;"Selection for sex in finite populations.";"Finite population size generates interference between selected loci, which has been shown to favour increased rates of recombination. In this article, I present different analytical models exploring selection acting on a 'sex modifier locus' (that affects the relative investment into asexual and sexual reproduction) in a finite population. Two forms of selective forces act on the modifier: direct selection due to intrinsic costs associated with sexual reproduction and indirect selection generated by one or two other loci affecting fitness. The results show that indirect selective forces differ from those acting on a recombination modifier even in the case of a haploid population: in particular, a single selected locus generates indirect selection for sex, while two loci are required in the case of a recombination modifier. This effect stems from the fact that modifier alleles increasing sex escape more easily from low-fitness genetic backgrounds than alleles coding for lower rates of sex. Extrapolating the results from three-locus models to a large number of loci at mutation-selection balance indicates that in the parameter range where indirect selection is strong enough to outweigh a substantial cost of sex, interactions between selected loci have a stronger effect than the sum of individual effects of each selected locus. Comparisons with multilocus simulation results show that such extrapolations may provide correct predictions for the evolutionarily stable rate of sex, unless the cost of sex is high."
"24634983";"UMI";"UMI";"Journal of the American Chemical Society";1;2014;"Comparative reactivity of different types of stable cyclic and acyclic mono- and diamino carbenes with simple organic substrates.";"A series of stable carbenes, featuring a broad range of electronic properties, were reacted with simple organic substrates. The N,N-dimesityl imidazolylidene (NHC) does not react with isocyanides, whereas anti-Bredt di(amino)carbene (pyr-NHC), cyclic (alkyl)(amino)carbene (CAAC), acyclic di(amino)carbene (ADAC), and acyclic (alkyl)(amino)carbene (AAAC) give rise to the corresponding ketenimines. NHCs are known to promote the benzoin condensation, and we found that the CAAC, pyr-NHC, and ADAC react with benzaldehyde to give the ketone tautomer of the Breslow intermediate, whereas the AAAC first gives the corresponding epoxide and ultimately the Breslow intermediate, which can be isolated. Addition of excess benzaldehyde to the latter does not lead to benzoin but to a stable 1,3-dioxolane. Depending on the electronic properties of carbenes, different products are also obtained with methyl acrylate as a substrate. The critical role of the carbene electrophilicity on the outcome of reactions is discussed."
"24584106";"UMI";"UMI";"AIDS reviews";1;2014;"Origin and diversity of human retroviruses.";"Simian immunodeficiency viruses, simian T‑cell lymphotropic viruses, and simian foamy viruses from nonhuman primates have crossed the species barrier to humans at several time points, leading to the HIV and human T lymphotropic virus epidemic and to sporadic cases of human infections with simian foamy viruses, respectively. Efficient infection and spread in humans differs between simian foamy virus, simian lymphotropic virus, and simian immunodeficiency virus, but seems also to differ among the different viruses from the same simian lineage, as illustrated by the different spread of HIV‑1 M, N O, P or for the different HIV‑2 groups. Among the four HIV‑1 groups, only HIV‑1 group M has spread worldwide, and the actual diversity within HIV‑1 M (subtypes, circulating recombinants) is the result of subsequent evolution and spread in the human population. HIV‑2 only spread to some extent in West Africa, and similarly as for HIV‑1, the nine HIV‑2 groups have also a different epidemic history. Four types of human T lymphotropic virus, type 1 to 4, have been described in humans and for three of them simian counterparts (simian T lymphotropic virus‑1, ‑2, ‑3) have been identified in multiple nonhuman primate species. The majority of human infections are with human T lymphotropic virus‑1, which is present throughout the world as clusters of high endemicity. Humans are susceptible to a wide variety of simian foamy viruses and seem to acquire these viruses more readily than simian immunodeficiency viruses or simian T lymphotropic viruses, but neither signs of disease in humans nor human‑to‑human transmission of simian foamy virus have been documented yet. The current HIV‑1 M epidemic illustrates the impact of a single cross‑species transmission. The recent discovery of HIV‑1 P, HIV‑2 I, new human T lymphotropic virus‑1 and ‑3 variants, as well as simian foamy virus infections in humans in Central Africa, show that our knowledge of genetic diversity and cross‑species transmissions of simian retroviruses is still incomplete."
"24559041";"UMI";"UMI";"Journal of the American Chemical Society";1;2014;"Isolation of bridging and terminal coinage metal-nitrene complexes.";"Transition metal complexes featuring a metal-nitrogen multiple bond have been widely studied due to their implication in dinitrogen fixation and catalytic nitrogen-carbon bond formation. Terminal copper- and silver-nitrene complexes have long been proposed to be the key intermediates in aziridination and amination reactions using azides as the nitrogen source. However, due to their high reactivity, these species have eluded isolation and spectroscopic characterization even at low temperatures. In this paper we report that a stable phosphinonitrene reacts with coinage metal trifluoromethanesulfonates, affording bridging and terminal copper- and silver-nitrene complexes, which are characterized by NMR spectroscopy and single crystal X-ray diffraction analysis."
"24471564";"UMI";"UMI";"The Journal of clinical endocrinology and metabolism";1;2014;"Role of sclerostin and dickkopf-1 in the dramatic alteration in bone mass acquisition in adolescents and young women with recent anorexia nervosa.";"BACKGROUND: The nutritional deprivation of adolescent girls with anorexia nervosa (AN) reduces bone mass acquisition. A better understanding of this process would improve the medical treatment of bone alteration and its long-term consequences.OBJECTIVE: The first aim was to model the bone mass acquisition in young women with AN. The second aim was to identify the clinical and biological factors associated with bone demineralization and investigate the potential role of sclerostin and dickkopf-1 protein (DKK-1).POPULATION AND METHODS: Ninety-eight AN patients (mean age 18.2 ± 2.6 years) and 63 age-matched controls were enrolled in this study. Areal bone mineral density (aBMD) was determined by dual-energy x-ray absorptiometry. Calciotropic hormones, bone turnover markers, sclerostin, DKK-1, and growth factors were concomitantly evaluated.RESULTS: The aBMD was significantly reduced at all bone sites in AN patients vs controls (range, -3.3% at the radius to -12.1% for total proximal femur). Bone formation markers IGF-1 and DKK-1 were significantly decreased in AN patients, whereas PTH, sclerostin, and the bone resorption markers were increased. In patients, the AN duration, amenorrhea, weight, body mass index, fat mass, and fat-free soft tissue were negatively correlated with aBMD, whereas the age of AN onset was positively correlated. Multiple regression analysis revealed that the duration of amenorrhea was the independent factor most negatively associated with aBMD at all bone sites except the radius.CONCLUSION: This case-control study demonstrated a dramatic reduction in aBMD, reinforced for the first time by our models, and indicates the need for early, systematic, and adapted bone mass monitoring. Moreover, appropriate treatment should be started early in patients with AN. Increased secretion of sclerostin suggests that it may be a target for pharmacological action."
"24452767";"UMI";"UMI";"Scientific reports";1;2014;"Two is better than one: physical interactions improve motor performance in humans.";"How do physical interactions with others change our own motor behavior? Utilizing a novel motor learning paradigm in which the hands of two - individuals are physically connected without their conscious awareness, we investigated how the interaction forces from a partner adapt the motor behavior in physically interacting humans. We observed the motor adaptations during physical interactions to be mutually beneficial such that both the worse and better of the interacting partners improve motor performance during and after interactive practice. We show that these benefits cannot be explained by multi-sensory integration by an individual, but require physical interaction with a reactive partner. Furthermore, the benefits are determined by both the interacting partner's performance and similarity of the partner's behavior to one's own. Our results demonstrate the fundamental neural processes underlying human physical interactions and suggest advantages of interactive paradigms for sport-training and physical rehabilitation."
"24445198";"UMI";"UMI";"The American journal of tropical medicine and hygiene";1;2014;"Effects of malnutrition on children's immunity to bacterial antigens in Northern Senegal.";"To evaluate immunity to vaccine-preventable diseases according to nutritional status, a longitudinal study was conducted in Senegalese children ages 1-9 years old. A linear regression analysis predicted that weight for age was positively associated with immunoglobulin G (IgG) response to tetanus toxoid in children born during the rainy season or at the beginning of the dry season. A relationship between village, time of visits, and levels of antibodies to tetanus showed that environmental factors played a role in modulating humoral immunity to tetanus vaccine over time. Moreover, a whole-blood stimulation assay highlighted that the production of interferon-γ (IFN-γ) in response to tetanus toxoid was compromised in stunted children. However, the absence of cytokine modulation in response to Mycobacterium tuberculosis-purified protein derivatives and phytohemagglutinin suggests that the overall ability to produce IFN-γ was preserved in stunted children. Therefore, these results show that nutritional status can specifically alter the efficacy of long-lasting immunity to tetanus."
"24430710";"UMI";"UMI";"Journal of human hypertension";1;2014;"Hypertension prevalence, awareness, treatment and control in Dakar (Senegal).";"The prediction of risk profile trends associated with non-communicable diseases in developing countries is among the greatest global health challenges. The aim of this study is to estimate prevalence, awareness, treatment and control of hypertension in Dakar (Senegal). This study was carried out between January and June 2009 on a population sample of 600 individuals living in the department of Dakar. This sample was constructed using the quota method in order to strive for representativeness. Sociodemographic characteristics, hypertension, hypertension awareness, treatment and control, and body mass index of individuals were collected during face-to-face interviews. Statistical analyses used were χ2-tests and binary logistic regressions. Prevalence of hypertension was 27.50%. Prevalence of awareness, treatment and control among hypertensives were 27.88%, 16.97% and 5.45%, respectively. Logistic regression showed that the prevalence, awareness and treatment of hypertension increased with increasing age. Overweight and obese subjects were more often hypertensive but did not differ from others in awareness and treatment. This could be linked to the social valorization of stoutness in West Africa, which explains that excess weight is not perceived as a risk factor for hypertension. In conclusion, given the very low rates of awareness, treatment and control in our sample, developing strategies for averting a hypertension epidemic must be a priority objective."
"25543032";"UMI";"UMI";"Genomics";0;2014;"Amplification-free sequencing of cell-free DNA for prenatal non-invasive diagnosis of chromosomal aberrations.";"Cell-free DNA has been used for fetal rhesus factor and sex determination, fetal aneuploidy screening, cancer diagnostics and monitoring, and other applications. However current methods of using cell free DNA require amplification, which leads to allelic dropout and bias especially when starting with small amounts of DNA. Here we describe an amplification-free method for sequencing of cell-free DNA, even from low levels of starting material. We evaluated this method in the context of prenatal diagnosis of fetal aneuploidy and compared it with a PCR-based library preparation method as well as a recently described method using unique molecular identifiers (UMI). All methods performed well, however coverage was increased by the amplification-free method and GC-induced bias was reduced by both the amplification-free method and the UMI method. Future diagnostic applications including whole genome sequencing of cell-free DNA will benefit from amplification-free sequencing."
"25542464";"UMI";"UMI";"Journal of clinical virology : the official publication of the Pan American Society for Clinical Virology";0;2014;"Mumps outbreak and laboratory diagnosis.";"BACKGROUND: Several mumps outbreaks have been reported in Europe and in the United States among highly vaccinated populations. Biological diagnosis is classically based on the detection of mumps-specific IgM, but the ability of serological tests to confirm mumps infection seems to be limited among vaccinated patients.OBJECTIVES: We aim to report a mumps outbreak in an engineering school in Grenoble, France, from February to June 2013 and results of the biological testing.STUDY DESIGN: WHO definitions were used to define cases. Mumps--specific IgM and IgG were assessed by a commercially available EIA. Mumps RNA detection by real time reverse transcriptase polymerase chain reaction tests (RT-PCR) and mumps genotyping were performed by the French National Reference Centre for Paramyxoviridae.RESULTS: Sixty two mumps patient-cases were identified using WHO case definitions, 20 being biologically explored, of which 17 were confirmed by biological tests. Vaccination status was documented for 27 patients/62: 4 (14.8%) patients had received one dose of MMR vaccine, and 23 (85.2) two doses of MMR vaccine. Among the biologically explored patients, 83% had a positive RT PCR at the first sampling whereas only 45% had positive or equivocal IgM. All the genotyped strains were genotype G.CONCLUSIONS: Mumps laboratory diagnosis in a highly vaccinated population is challenging. Serological tests among vaccinated patients should be interpreted cautiously and confirmed by RT-PCR tests at the beginning of a mumps outbreak."
"25527333";"UMI";"UMI";"Journal of the International AIDS Society";0;2014;"Antiretroviral treatment outcome in HIV-1-infected patients routinely followed up in capital cities and remote areas of Senegal, Mali and Guinea-Conakry.";"INTRODUCTION: Access to antiretroviral treatment (ART) becomes more and more effective in resource-limited settings (RLS). However, this global effort would be even more profitable if the access to laboratory services especially in decentralized settings was strengthened. We report the virological outcome and HIV-1 drug resistance in three West African countries using dried blood spots (DBS) samples.METHODS: We included HIV-1-infected adults on ART ≥6 months and followed up in capital cities and decentralized sites in Senegal, Mali and Guinea-Conakry. Patients were consecutively enrolled and DBS were collected in field conditions and kept at ambient temperature before transfer to the reference laboratory. Viral load (VL) was quantified using the NucliSENS EasyQ HIV-1 v1.2. Genotyping of HIV-1 pol gene was performed using in-house protocol.RESULTS: Of the 407 participants, 119, 152 and 136 were from Senegal, Mali and Guinea-Conakry, respectively. The median treatment duration was 36 months [IQR: 6-136]. Virological failure (VF) (VL≥3log10 copies/mL) was observed in 26% (95% confidence interval (CI), 18-35; n=31), 11% (95% CI, 6-17; n=16) and 24% (95% CI, 17-32; n=33) of patients in Senegal, Mali and Guinea-Conakry, respectively (p=0.001). Of samples presenting VL≥3log10 copies/mL (n=80), 70 were successfully genotyped. At least one drug resistance mutation (DRM) was detected in the following proportions: 70% (95% CI, 50-86; n=19), 93% (95% CI, 68-100; n=14) and 68% (95% CI, 48-84; n=19) in Senegal, Mali and Guinea-Conakry, respectively (p=0.22). Twenty-six per cent (26%; 95% CI, 16-38; n=18) of patients in VF harboured wild-type viruses, which is likely indicative of weak adherence. Phylogenetic analysis showed the predominance of CRF02_AG subtype (73%; 95% CI, 61-83; n=51).CONCLUSIONS: We describe the ART outcome in capital and rural settings of Senegal, Mali and Guinea-Conakry. Our results in all of the three countries highlight the need to reinforce the ART adherence in order to minimize the occurrence of drug resistance. In addition, these findings provide additional evidence that the use of DBS as a sampling support could assist virological monitoring of patients on ART in remote areas."
