"PMID";"Method";"Search_Term";"Journal";"Citations";"YearPubmed";"Title";"Abstract"
"24105742";"UMI";"UMI";"Chemistry (Weinheim an der Bergstrasse, Germany)";0;2013;"Experimental and computational studies of anti-Bredt amidinium salts.";"Experimental and computational investigations of anti-Bredt amidinium salts are presented. Calculations show that the pyramidalization of an amino group can significantly destabilize the formal carbocation center of amidiniums, due to the decreased π donation. In some cases, the unfavorable -I effect of nitrogen surpasses its beneficial +M effect, and amidiniums become less stable than iminiums. It is shown that although 1-aza-3-azonia[3.3.1]bicyclo-non-2-enes can be isolated, they feature a nonclassical reactivity, which is more typical for iminium than amidinium salts, such as pronounced electrophilicity and azomethineylide instead of carbene formation."
"24079915";"UMI";"UMI";"Ultrasonics";0;2013;"Experimental study of ultrasonic beam sectors for energy conversion into Lamb waves and Rayleigh waves.";"When a bounded beam is incident on an immersed plate Lamb waves or Rayleigh waves can be generated. Because the amplitude of a bounded beam is not constant along its wave front, a specific beam profile is formed that influences the local efficiency of energy conversion of incident sound into Lamb waves or Rayleigh waves. Understanding this phenomenon is important for ultrasonic immersion experiments of objects because the quality of such experiments highly depends on the amount of energy transmitted into the object. This paper shows by means of experiments based on monochromatic Schlieren photography that the area within the bounded beam responsible for Lamb wave generation differs from that responsible for Rayleigh wave generation. Furthermore it provides experimental verification of an earlier numerical study concerning Rayleigh wave generation."
"24055553";"UMI";"UMI";"Toxicon : official journal of the International Society on Toxinology";0;2013;"Spatial and thematic distribution of research on cyanotoxins.";"Cyanobacteria in surface water are well known for their ability to form toxic blooms responsible for animal mortality and human poisoning. Accompanying major progress in science and technology, the state of knowledge of cyanotoxins has dramatically increased over the last two decades. The bibliometric approach applied in this study shows the evolution of research and identifies major gaps to be filled by future work. Although the publication rate has gradually increased from one hundred to three hundred articles per year since the 1990s, half of the literature available focuses on microcystins and another quarter on saxitoxins. Other cyanotoxins such as beta-N-methylamino-l-alanine or cylindrospermopsin remain vastly disregarded. Moreover, most of the publications deal with toxicity and ecology while other research areas, such as environmental and public health, require additional investigation. The analysis of the literature highlights the main journals for the communication of knowledge on cyanotoxins but also reveals that 90% of the research is originated from only ten countries. These countries are also those with the highest H-index and average number of citation per article. Nonetheless, the ranking of these countries is significantly altered when the amount of publications is normalized based on the population, the number of universities, the national gross domestic product or the government revenue. However, the lower amount of publications from Eastern Europe, Africa and South America could also reflect the lack of monitoring campaigns in these regions. This lack could potentially lead to the underestimation of the prevalence of toxic cyanobacterial blooms and the diversity of toxins worldwide."
"24035811";"UMI";"UMI";"Infection, genetics and evolution : journal of molecular epidemiology and evolutionary genetics in infectious diseases";0;2013;"High frequency of HIV-1 infections with multiple HIV-1 strains in men having sex with men (MSM) in Senegal.";"Circulating and unique recombinant HIV-1 strains continue to be identified and their number increases over time, suggesting that co-infection with multiple HIV-1 is frequent. In this study we analyzed to what extent dual infections with different HIV-1 variants occur in a population group with high risk behaviour, high HIV-1 prevalence and in an area where multiple HIV-1 subtypes and Circulating Recombinant Forms (CRFs) co-circulate. We studied 69 MSM with our recently developed multi-region hybridization assay (MHA), based on fluorescent probe detection for eight common variants circulating in West and West Central Africa. At least 11 (15.9%) of the 69 patients were simultaneously infected with two different HIV-1 subtypes and/or CRFs. Among the 29 samples identified as subtype C by MHA in gag, 15 (57.7%) reacted with both C1 and C2 probes. Sequence analysis suggests that the majority of the samples reactive with C1 and C2 probes are most likely infected with two different subtype C clades. Single genome amplification and DNA dilutions confirmed dual infection with subtype D and C for MSM1193, triple infection with two different C subtype strains and one CRF02_AG strain in MSM1157 and showed that MSM3017 is at least co-infected with CRF06_cpx and CRF02_AG and another strain that could not be classified. Comparison of all subtype C sequences from the MSM population and from the general population from this and previous studies confirmed the intermixing of HIV-1 variants between low-risk women and high-risk men as shown by the intermixing of subtype C variants from MSM1157 and a female patient (02SN-HALD478). Comparison of dual infection rates between the general population and MSM in Senegal, show also clearly the importance of high HIV prevalence and high risk behavior in dual infections and subsequent intermixing of HIV-1 variants which can lead to emergence and spread of new recombinants (CRFs)."
"24035660";"UMI";"UMI";"Ultrasonics";0;2013;"Baseline subtraction technique in the frequency-wavenumber domain for high sensitivity damage detection.";"This paper suggests a method for high-sensitivity damage detection. The method is based on pitch-catch measurements of Lamb waves combined with a baseline subtraction technique in the frequency-wavenumber domain. Small amplitude converted modes, generated during the interaction of propagating waves with damage, can thus be detected with minimal a priori information regarding their expected location in the frequency-wavenumber plane. This method is applied in the present paper to a case of notches with varied depth. Finite element simulations are carried out in the temporal domain to mimic results obtainable in real-world experiments. Two cases are studied, namely when each of the two pure fundamental modes are incident on a notch. The advantages of the method are detailed. The procedure to implement this method is described in the context of Structural Health Monitoring (SHM) or Non-Destructive Testing (NDT)."
"24011334";"UMI";"UMI";"Expert review of anti-infective therapy";0;2013;"The origin and molecular epidemiology of HIV.";"HIV-1 in humans resulted from at least four cross-species transmissions of simian immunodeficiency viruses (SIVs) from chimpanzees and gorillas in West Central Africa, while HIV-2 viruses resulted from at least eight independent transmissions of SIVs infecting sooty mangabeys in West Africa only, where one of these transmissions (HIV-1 group M) is responsible for the global epidemic. HIV-1 M is subdivided into nine subtypes and a wide diversity of circulating recombinant forms (CRFs) and unique recombinant forms. The heterogenic HIV-1 M subtype/CRF distribution is the result of founder effects. The genetic diversity of HIV-1 continues to increase overtime due to demographic factors such as travel and migration and frequent co/superinfections. In addition, the expanded access to antiretrovirals leads to an increasing number of drug-resistant strains, especially in resource limited countries."
"24007472";"UMI";"UMI";"Journal of the American Chemical Society";0;2013;"Crystalline, Lewis base-free, cationic phosphoranimines (iminophosphonium salts).";"Cationic phosphoranimines have been postulated as intermediates in phosphazene polymerization chemistry. However, the high electrophilicity of the phosphorus center has so far prevented their characterization. Here, we report the synthesis of two Lewis base-free iminophosphonium salts, obtained by reaction of a stable phosphinonitrene with methyl trifluoromethanesulfonate and trifluoromethanesulfonic acid. These cationic species were characterized by NMR spectroscopy and single-crystal X-ray diffraction analysis. Using 4-(dimethylamino)pyridine, a corresponding Lewis-base adduct has also been isolated."
"23960023";"UMI";"UMI";"Chemistry, an Asian journal";0;2013;"Carbodicarbenes, carbon(0) derivatives, can dimerize.";""
"23930982";"UMI";"UMI";"Culture, health &amp; sexuality";0;2013;"Ethnicity, socioeconomic characteristics and knowledge, beliefs and attitudes about HIV among Yunnanese Chinese, Hmong, Lahu and Northern Thai in a north-western Thailand border district.";"Data from ethnically diverse north-western Thailand with recent migrants from Myanmar (Burma) and China allow testing of hypotheses concerning between- and within-community differences in predominantly Yunnanese Chinese, Hmong and Lahu ethnic minority villages versus ethnic majority Thai villages. Topics include knowledge of HIV transmission, prevention and treatment, avoidance of people infected with HIV and constraints to use of health services. Respondents include women with one or more children under age five and their husbands/partners. Ethnicity is consistently associated with socioeconomic characteristics, knowledge of HIV transmission, prevention and treatment, avoidance of people living with HIV and AIDS, and constraints to use of services. Chinese community residents had the lowest levels of knowledge of HIV, especially with regard to mother-to-child transmission, the most intent to avoid contact with people living with HIV and AIDS, and the highest levels of constraints to using services, including ineligibility for government healthcare and limited Thai language ability. Associations of counselling with Thai language ability, and more knowledge and less avoidance of people living with HIV and AIDS, suggest that language-appropriate health education may help overcome disparities."
"23916828";"UMI";"UMI";"Journal of clinical virology : the official publication of the Pan American Society for Clinical Virology";0;2013;"Analysis of residual perinatal transmission of hepatitis B virus (HBV) and of genetic variants in human immunodeficiency virus and HBV co-infected women and their offspring.";"BACKGROUND: Despite implementation of universal infant hepatitis B (HB) vaccination, mother-to-child transmission (MTCT) of hepatitis B virus (HBV) still occurs. Limited data are available on the residual MTCT of HBV in human immunodeficiency virus (HIV)-HBV co-infected women.OBJECTIVES: We assessed the prevalence of HBV infection among HIV-infected pregnant women and the rate of residual MTCT of HBV from HIV-HBV co-infected women and analyzed the viral determinants in mothers and their HBV-infected children.STUDY DESIGN: HIV-1 infected pregnant women enrolled in two nationwide perinatal HIV prevention trials in Thailand were screened for HB surface antigen (HBsAg) and tested for HBeAg and HBV DNA load. Infants born to HBsAg-positive women had HBsAg and HBV DNA tested at 4-6 months. HBV diversity within each HBV-infected mother-infant pair was analyzed by direct sequencing of amplified HBsAg-encoding gene and cloning of amplified products.RESULTS: Among 3312 HIV-1 infected pregnant women, 245 (7.4%) were HBsAg-positive, of whom 125 were HBeAg-positive. Of 230 evaluable infants born to HBsAg-positive women, 11 (4.8%) were found HBsAg and HBV DNA positive at 4-6 months; 8 were born to HBeAg-positive mothers. HBV genetic analysis was performed in 9 mother-infant pairs and showed that 5 infants were infected with maternal HBV variants harboring mutations within the HBsAg &quot;a&quot; determinant, and four were infected with wild-type HBV present in highly viremic mothers.CONCLUSIONS: HBV-MTCT still occurs when women have high HBV DNA load and/or are infected with HBV variants. Additional interventions targeting highly viremic women are thus needed to reduce further HBV-MTCT."
"23878717";"UMI";"UMI";"Chemical science (Royal Society of Chemistry : 2010)";0;2013;"Carbene-Stabilized Main Group Radicals and Radical Ions.";"Shortly after their discovery at the end of the 80s, stable singlet carbenes have been recognized as excellent ligands for transition metal based catalysts, and as organo-catalysts in their own right. At the end of the 2000s, it has been shown that they can coordinate main group elements in their zero oxidation state, and even activate small molecules. This review covers examples in the literature dealing with the most recent application of stable singlet carbenes, namely their use to stabilize radicals and radical ions that are otherwise unstable."
"23844803";"UMI";"UMI";"SAHARA J : journal of Social Aspects of HIV/AIDS Research Alliance / SAHARA , Human Sciences Research Council";0;2013;"[Disclosure of infant HIV status: mothers' experiences and health workers' interpretations in Burkina Faso].";"Disclosure of HIV status in infants is a special case which does not correspond to general recommendations for counseling as defined for adults, and few norms exist. Whereas preventing mother to child transmission (PMTCT) programs should result in 700,000 annual disclosures regarding infants born to HIV-positive mothers in Africa, the actual figures are much lower and the conditions for disclosure implementation and its social dimensions in the field are not precisely documented. The aims of this article are to describe and analyze the experience of HIV status disclosure for infants and children on the basis of interviews held with mothers and PMTCT teams in Burkina Faso. The method was based on repeated interviews with 37 mothers and with health workers. Their discourses show the complexity of disclosure in a context characterized by uncertainty. They show delays due to difficulties in venipuncture and in methods for laboratory diagnosis and information management in health services. HIV disclosure is implemented by PMTCT physicians and also other professionals, sometimes in other services. The mother plays a key role, sometimes by requesting disclosure; the father is generally informed only secondarily, in spite of his legal responsibility for the child. Interactions analysis reveals some ambiguities of disclosure, regarding information that doctors keep secret, reciprocal expectations of communication between doctors and mothers, mothers' interpretation of apparent signs regarding their child's health, and uncertain information being given. The information often contains guilt-inducing elements for mothers; communication about follow-up does not reduce this effect. These results encourage the elaboration of a model for specific counseling that should provide mothers with general information, and personalized interaction and support that they need in order to receive and manage disclosure of their child's HIV status."
"23765789";"UMI";"UMI";"Angewandte Chemie (International ed. in English)";0;2013;"Deprotonation of a borohydride: synthesis of a carbene-stabilized boryl anion.";"An acidic hydride! Thanks to the presence of a π-acceptor cyclic alkyl amino carbene and of two electron-withdrawing nitrile groups, a borohydride reacts with a base to give a carbene-stabilized boryl anion, which reacts with carbon and metal electrophiles at the boron center. Dipp = 2,6-diisopropylphenyl, KHMDS = potassium bis(trimethylsilyl)amide."
"23757190";"UMI";"UMI";"International journal for numerical methods in biomedical engineering";0;2013;"Reproduction of pressure field in ultrasonic-measurement-integrated simulation of blood flow.";"Ultrasonic-measurement-integrated (UMI) simulation of blood flow is used to analyze the velocity and pressure fields by applying feedback signals of artificial body forces based on differences of Doppler velocities between ultrasonic measurement and numerical simulation. Previous studies have revealed that UMI simulation accurately reproduces the velocity field of a target blood flow, but that the reproducibility of the pressure field is not necessarily satisfactory. In the present study, the reproduction of the pressure field by UMI simulation was investigated. The effect of feedback on the pressure field was first examined by theoretical analysis, and a pressure compensation method was devised. When the divergence of the feedback force vector was not zero, it influenced the pressure field in the UMI simulation while improving the computational accuracy of the velocity field. Hence, the correct pressure was estimated by adding pressure compensation to remove the deteriorating effect of the feedback. A numerical experiment was conducted dealing with the reproduction of a synthetic three-dimensional steady flow in a thoracic aneurysm to validate results of the theoretical analysis and the proposed pressure compensation method. The ability of the UMI simulation to reproduce the pressure field deteriorated with a large feedback gain. However, by properly compensating the effects of the feedback signals on the pressure, the error in the pressure field was reduced, exhibiting improvement of the computational accuracy. It is thus concluded that the UMI simulation with pressure compensation allows for the reproduction of both velocity and pressure fields of blood flow."
"23747911";"UMI";"UMI";"Frontiers in bioscience (Elite edition)";0;2013;"Silicon nanotweezers for biomechanical and bioelectrical assays.";"In modern life, technologies enabling detection of biological molecules at a low threshold, for health and ecological concerns, are in high demand. Directly interrogating the molecules is a promising direction to clarify the noisy response of conventional assays arising from simultaneous different reactions. Besides sophisticated biophysical instrument such as the atomic force microscope, this paper proposes silicon nanotweezers (SNT) as a new microsystem for molecular manipulation. SNT can trap molecules and sense their biomechanical and bioelectrical response in minute operations. In this review SNT characteristics are overviewed; their operation modes are illustrated by molecule and cell trapping, manipulation and characterization in air and in solution. As they are tiny and can be mass produced by highly parallel microsystem technology, SNT can be seen as a potential molecular and cellular probe for routine analysis and bio detection."
"23737628";"UMI";"UMI";"CBE life sciences education";0;2013;"Toward university modeling instruction--biology: adapting curricular frameworks from physics to biology.";"University Modeling Instruction (UMI) is an approach to curriculum and pedagogy that focuses instruction on engaging students in building, validating, and deploying scientific models. Modeling Instruction has been successfully implemented in both high school and university physics courses. Studies within the physics education research (PER) community have identified UMI's positive impacts on learning gains, equity, attitudinal shifts, and self-efficacy. While the success of this pedagogical approach has been recognized within the physics community, the use of models and modeling practices is still being developed for biology. Drawing from the existing research on UMI in physics, we describe the theoretical foundations of UMI and how UMI can be adapted to include an emphasis on models and modeling for undergraduate introductory biology courses. In particular, we discuss our ongoing work to develop a framework for the first semester of a two-semester introductory biology course sequence by identifying the essential basic models for an introductory biology course sequence."
"23720417";"UMI";"UMI";"Angewandte Chemie (International ed. in English)";0;2013;"An air-stable oxyallyl radical cation.";""
"23712767";"UMI";"UMI";"Statistics in medicine";0;2013;"Nonlinear multiple imputation for continuous covariate within semiparametric Cox model: application to HIV data in Senegal.";"Multiple imputation is commonly used to impute missing covariate in Cox semiparametric regression setting. It is to fill each missing data with more plausible values, via a Gibbs sampling procedure, specifying an imputation model for each missing variable. This imputation method is implemented in several softwares that offer imputation models steered by the shape of the variable to be imputed, but all these imputation models make an assumption of linearity on covariates effect. However, this assumption is not often verified in practice as the covariates can have a nonlinear effect. Such a linear assumption can lead to a misleading conclusion because imputation model should be constructed to reflect the true distributional relationship between the missing values and the observed values. To estimate nonlinear effects of continuous time invariant covariates in imputation model, we propose a method based on B-splines function. To assess the performance of this method, we conducted a simulation study, where we compared the multiple imputation method using Bayesian splines imputation model with multiple imputation using Bayesian linear imputation model in survival analysis setting. We evaluated the proposed method on the motivated data set collected in HIV-infected patients enrolled in an observational cohort study in Senegal, which contains several incomplete variables. We found that our method performs well to estimate hazard ratio compared with the linear imputation methods, when data are missing completely at random, or missing at random."
"23696290";"UMI";"UMI";"Nanotechnology";0;2013;"A damascene platform for controlled ultra-thin nanowire fabrication.";"This paper presents a damascene process for the fabrication of titanium micro/nanostructures and nanowires with adjustable thickness down to 2 nm. Their depth is precisely controlled by chemical-mechanical planarization together with in-process electrical characterization. The latter, in combination with a model of the titanium resistivity versus thickness, allows control of the metal line depth in the nanometer range. In summary, we have developed a planarization end point detection method for metal nanostructures. In addition, the model adopted covers geometrical influences like oxidation and ageing. The fabricated titanium nanowire test structures have a thickness ranging from 2 to 25 nm and a width ranging between 15 and 230 nm."
"23692972";"UMI";"UMI";"Neural networks : the official journal of the International Neural Network Society";0;2013;"Template based black-box optimization of dynamic neural fields.";"Due to their strong non-linear behavior, optimizing the parameters of dynamic neural fields is particularly challenging and often relies on expert knowledge and trial and error. In this paper, we study the ability of particle swarm optimization (PSO) and covariance matrix adaptation (CMA-ES) to solve this problem when scenarios specifying the input feeding the field and desired output profiles are provided. A set of spatial lower and upper bounds, called templates are introduced to define a set of desired output profiles. The usefulness of the method is illustrated on three classical scenarios of dynamic neural fields: competition, working memory and tracking."
"23667264";"UMI";"UMI";"Clinical infectious diseases : an official publication of the Infectious Diseases Society of America";0;2013;"Prediction of HIV drug resistance based on virologic, immunologic, clinical, and/or adherence criteria in the Stratall ANRS 12110/ESTHER trial in Cameroon.";"Our study in Cameroonian rural district hospitals showed that the immunologic and clinical failure criteria had poor performance to identify human immunodeficiency virus drug resistance in a timely manner. Switching to second-line antiretroviral therapy after 2 consecutive viral loads ≥5000 copies/mL, as recommended by the World Health Organization, appeared to be the most appropriate strategy."
