"PMID";"Method";"Search_Term";"Journal";"Citations";"YearPubmed";"Title";"Abstract"
"21141125";"UMI";"UMI";"Zhonghua lao dong wei sheng zhi ye bing za zhi = Zhonghua laodong weisheng zhiyebing zazhi = Chinese journal of industrial hygiene and occupational diseases";1;2010;"[Effect of occupational stress on hypertension].";"OBJECTIVE: To explore the effect of occupational stress on hypertension.METHODS: 498 workers whose accumulative length of service was more than two years were investigated with questionnaire by method of cluster sampling from a thermal power plant in Henan province in China; 446 respondents returned qualified questionnaire including 281 male and 165 female Han People. After the patients with secondary hypertension, diabetes patients, and patients with liver or kidney disease were excluded, 84 workers (58 males and 26 females) were diagnosed as hypertension. The occupational stressors, personalities, buffering factors and occupational strain were measured by using the Job Demand-control Model, the Effort-reward Imbalance Model questionnaires and Occupational Stress Measurement Scale. Main risk factors for the development of hypertension such as heredity, body mass index, high salt diet, alcohol use, smoking habit and lack of physical activity were investigated. 498 whole blood samples were collected from workers in field epidemiologic survey. All of the samples were detected TG, CHO and FPG by common biochemistry methods. Multivariate logistic regression analysis were used to determine the relationship between occupational stressors and prevalence rate of hypertension. The difference of morbidity of hypertension between different stress level subjects was analyzed by chi2 test.RESULTS: (1) Logistic regression analysis of the hypertension by all occupational stressors and risk factors of hypertension indicated that not only some common factors such as parents' hypertensive history, BMI, alcohol use and TG, but also responsibility for person, work locus of control and social support were significantly correlated with elevated risks of hypertension. (2) Logistic regression analysis of the hypertension by main dimensions of effort-reward imbalance model and risk factors of hypertension indicated that parents' hypertensive history, BMI, alcohol use, TG, and effort were significantly correlated with elevated risks of hypertension. Logistic regression analysis indicated the risk of hypertension had an effect on the FRI and effort (OR was 1.71 and 2.43 respectively). (3) For the job strain model, results indicated that parents' hypertensive history, UMI, alcohol use, TG, work locus of control and social support were significantly correlated with elevated risks of hypertension. But the main dimensions of job strain model (job demands and decision latitude) didn't enter regression equation. (4) The difference of prevalence of hypertension between high- and low stress level groups in male was statistically significant (OR = 3.13, P &lt; 0.01), but the case was not the same in female (P &gt; 0.05).CONCLUSIONS: Occupational stress might be risk factor of hypertension; The predictive power of effort-reward imbalance model for the development of hypertension would be larger than that of job strain model."
"20849433";"UMI";"UMI";"Journal of clinical periodontology";1;2010;"Clinical and microbiological effects of mechanical instrumentation and local antimicrobials during periodontal supportive therapy in aggressive periodontitis patients: smoker versus non-smoker patients.";"AIM: To compare the clinical and microbiological effects of ultrasonic mechanical instrumentation (UMI) associated to home-care use of amine fluoride/stannous fluoride (AmF/SnF(2) )-containing mouthrinse and toothpaste in smoker and non-smoker patients affected by generalized aggressive periodontitis (G-AgP) during a recall session of supportive periodontal therapy (SPT).MATERIAL AND METHODS: Thirteen smokers and 25 non-smokers G-AgP patients enrolled in an SPT programme received a single session of UMI associated with home-care use of AmF/SnF(2) -containing mouthrinse and toothpaste. Clinical and microbiological parameters were assessed pre-treatment, at 6 and 12 weeks post-treatment.RESULTS: In both groups, UMI plus AmF/SnF(2) -implemented oral hygiene use determined a significant decrease of total bacterial counts, with non-smokers exhibiting a lower count compared with smokers at 12 weeks. No significant differences were observed between smokers and non-smokers in the counts of total pathogens and red complex species at each observation interval. Clinically, a significant reduction of supragingival plaque, gingival inflammation and probing pocket depth was similarly observed in both groups.CONCLUSIONS: A combined mechanical/chemical plaque control approach based on UMI and the use of AmF/SnF(2) agents resulted in the reduction of supragingival plaque deposits, gingival inflammation and subgingival periodontal pathogens in G-AgP patients during SPT, with no substantial difference between smokers and non-smokers."
"20423985";"UMI";"UMI";"European journal of endocrinology / European Federation of Endocrine Societies";1;2010;"Bone mineral density acquisition in peripubertal female rhythmic gymnasts is directly associated with plasma IGF1/IGF-binding protein 3 ratio.";"OBJECTIVES: Intense physical activity in peripubertal girls may delay menarche and cause menstrual disorders and estrogen deficiency, particularly in sport disciplines that require strict weight control. It may also have a deleterious effect on bone mass acquisition. The aim of this study was to determine the time-course of bone mass accretion in peripubertal elite female rhythmic gymnasts (FRGs) over a 1-year period, as well as the anthropometric and hormone parameters that could be helpful for predicting bone mineral density (BMD) gain.METHODS AND DESIGN: We conducted a 1-year follow-up study in 29 FRGs (10.7-16.1 years old). Whole body composition and BMD of the whole body, proximal femur, lumbar spine, mid-radius, and skull were measured by dual energy X-ray absorptiometry (DXA). Moreover, baseline growth- and bone metabolism-related hormones such as IGF1, IGF-binding protein 3 (IGFBP3), leptin, and bone markers were measured.RESULTS: BMD increased significantly at all bone sites throughout puberty, particularly between Tanner stages II and IV-V (P=0.025 to P&lt;0.001). The IGF1 level, IGF1/IGFBP3 ratio, and leptin level were higher in late pubertal stages (i.e. IV-V) compared with early stage (i.e. I). In simple and multivariate analyses, only the IGF1/IGFBP3 ratio was strongly correlated with the BMD change at all bone sites (r=0.49, P=0.02 to r=0.77, P&lt;0.0001).CONCLUSION: This 1-year follow-up study of peripubertal FRGs showed that BMD gain was maximal around Tanner stage III. The plasma IGF1/IGFBP3 ratio was associated with bone mass acquisition in this period, and it may thus serve as a surrogate marker of bone mass gain in this population."
"20124710";"UMI";"UMI";"Acta crystallographica. Section F, Structural biology and crystallization communications";1;2010;"A micromolar O-sulfated thiohydroximate inhibitor bound to plant myrosinase.";"The 1.6 A resolution structure of the micromolar competitive inhibitor S-(N,N-dimethylaminoethyl) phenylacetothiohydroximate-O-sulfate bound to Sinapis alba myrosinase, a plant thioglucosidase, is reported. Myrosinase and its substrates, the glucosinolates, are part of the plant's defence system. The sulfate group and the phenyl group of the inhibitor bind to the aglycon-binding site of the enzyme, whereas the N,N-dimethyl group binds to the glucose-binding site and explains the large improvement in binding affinity compared with previous compounds. The structure suggests ways to increase the potency and specificity of the compound by improving the interactions with the hydrophobic pocket of the aglycon-binding site."
"20052135";"UMI";"UMI";"Optics express";1;2010;"A 24 km fiber-based discretely signaled continuous variable quantum key distribution system.";"We report a continuous variable key distribution system that achieves a final secure key rate of 3.45 kilobits/s over a distance of 24.2 km of optical fiber. The protocol uses discrete signaling and post-selection to improve reconciliation speed and quantifies security by means of quantum state tomography. Polarization multiplexing and a frequency translation scheme permit transmission of a continuous wave local oscillator and suppression of noise from guided acoustic wave Brillouin scattering by more than 27 dB."
"21118762";"UMI";"UMI";"IEEE transactions on bio-medical engineering";0;2010;"Numerical analysis of effects of measurement errors on ultrasonic-measurement-integrated simulation.";"Ultrasonic-measurement-integrated (UMI) simulation, in which feedback signals are applied to the governing equations based on errors between ultrasonic measurement and numerical simulation, has been investigated for reproduction of the blood flow field. However, ultrasonic measurement data inherently include some errors. In this study, the effects of four major measurement errors, namely, errors due to gaussian noise, aliasing, wall filter, and lack of data, on UMI simulation were examined by a numerical experiment dealing with the blood flow field in the descending aorta with an aneurysm, the same as in our previous study. While solving the governing equations in UMI simulation, gaussian noise did not prevent the UMI simulation from effectively reproducing the blood flow field. In contrast, aliasing caused significant errors in UMI simulation. Effects of wall filter and lack of data appeared in diastole and in the whole period, respectively. By detecting significantly large feedback signals as a sign of aliasing and by not adding feedback signals where measured Doppler velocities were aliasing or zero, the computational accuracy substantially improved, alleviating the effects of measurement errors. Through these considerations, UMI simulation can provide accurate and detailed information on hemodynamics with suppression of four major measurement errors."
"20945453";"UMI";"UMI";"Chemistry, an Asian journal";0;2010;"Synthesis of a room-temperature-stable dimeric copper(I) hydride.";""
"20858337";"UMI";"UMI";"Santé publique (Vandoeuvre-lès-Nancy, France)";0;2010;"[Blood donation in foreign populations in Marseille].";"Blood donations by populations from the Maghreb and Sub-Saharan Africa are a public health necessity for reasons of genetic polymorphism. This article aims to determine whether blood donors' social characteristics ? i.e. greater socio-economic integration and a strong sense of citizenship ? constitute deterrents to blood donation among foreign populations. Results show that donors from the Maghreb and Sub-Saharan Africa are not better integrated than non-donors from the same areas. However, blood donors express a significantly greater sense of citizenship than non-donors. Donors from the Maghreb and Sub-Saharan Africa feel a greater sense of citizenship than non-donors from the same areas. The study of blood donation in these categories of population has two major implications. In biological terms, blood donation by foreign populations constitutes a response to transfusion needs. In cultural terms, blood donation is used by populations from the Maghreb and Sub-Saharan Africa as an active means of expressing their sense of citizenship."
"20607465";"UMI";"UMI";"Clinical orthopaedics and related research";0;2010;"Does the upward migration index predict function and quality of life in arthroscopic rotator cuff repair?";"BACKGROUND: Although upward humeral head migration is a well-recognized phenomenon in patients with tears of the cuff, it is unclear whether it relates to patient function after cuff repair. The upward migration index (UMI) assesses proximal migration of the humeral head while controlling for patients' bony morphologic features.PURPOSES: We asked whether functional and quality-of-life (QOL) improvement occurs longitudinally in patients with low, moderate, or high degrees of proximal humeral migration after arthroscopic cuff repair and whether differences occur between groups.PATIENTS AND METHODS: We retrospectively reviewed 118 patients with full-thickness tears treated by arthroscopic cuff repair. Patients were divided into three groups depending on the severity of preoperative proximal humeral migration seen on MRI. We determined function using two functional scores and the Western Ontario Rotator Cuff Index (a QOL index). Evaluations were performed preoperatively and 6 and 12 months postoperatively. A general linear model analysis controlled for patient characteristics, including the UMI, to determine their effects on functional and QOL scores.RESULTS: Function and QOL improved after surgery in all three groups. The UMI did not correlate with final functional or QOL scores. Six-month functional and QOL scores correlated with final scores. The best predictor of final strength was initial strength.CONCLUSIONS: Preoperative UMI did not correlate with functional or QOL improvements after surgery. The data suggest substantial proximal migration of the humeral head, as measured by the UMI, should not be considered a contraindication to arthroscopic rotator cuff repair."
"20600132";"UMI";"UMI";"Journal of theoretical biology";0;2010;"Competition and species coexistence in a metapopulation model: can fast asymmetric migration reverse the outcome of competition in a homogeneous environment?";"We investigate whether asymmetric fast migration can modify the predictions of classical competition theory and, in particular revert species dominance. We consider a model of two species competing for an implicit resource on a habitat divided into two patches. Both patches are connected through constant migration rates and in each patch local dynamics are driven by a Lotka-Volterra competition system. Local competition is asymmetric with the same superior competitor in both patches. Migration is asymmetric, species dependent and fast in comparison to local competitive interactions. The species and patches are taken to be otherwise similar: in both patches we assume the same carrying capacities for both species, and the same growth rates and pair-wise competition coefficients for each species. We show that global dynamics can be described by a classical Lotka-Volterra competition model. We found that by modifying the ratio of intraspecific migration rates for both species all possible combinations of global species relative dominance can be achieved. We find specific conditions for which the local superior competitor is globally excluded. This is to our knowledge the first study showing that fast asymmetric migration can lead to inferior competitor dominance in a homogeneous environment. We conclude that disparity of temporal scales between migration and local dynamics may have important consequences for the maintenance of biodiversity in spatially structured populations."
"20561294";"UMI";"UMI";"Transfusion";0;2010;"Sociodemographic and attitudinal factors to blood donation in the urban population of Dakar, Senegal.";"BACKGROUND: The objectives of this analysis were 1) to compare the sociodemographic characteristics of donors and nondonors, 2) to describe the channels through which Dakar's population is made aware of blood donation, and 3) to analyze the motivations and barriers to blood donation expressed by donors and nondonors.STUDY DESIGN AND METHOD: A survey of 600 individuals age 20 and older representative of Dakar's population was conducted in 2009 to analyze awareness of blood donation, donor characteristics, and barriers and motivations to blood donation.RESULTS: A total of 94.7% of the respondents had already heard of giving blood and 25.8% had already donated. Men and individuals age 40 and over are overrepresented among donors (chi-square [1ddl]= 19.54, p&lt;0.001; chi-square [3ddl]=14.24, p&lt;0.01). Those with higher education were also more likely to be donors (chi-square [4ddl]=38.91, p&lt;0.001). Main motivations to blood donation are altruism (43%) and awareness of a blood shortage (20.33%). Never having been contacted to give blood is the number one obstacle to blood donation (37.31%).CONCLUSIONS: In Dakar, the vast majority of people are familiar with the practice of giving blood. The sociodemographic characteristics of blood donors, and the main motivations and barriers to blood donation are the same in Dakar as in other countries, but this study also demonstrates the importance to inform Dakarites that blood donation does not amount to a blood test, that donating is not harmful for one's health, and that the blood donated is quickly regenerated."
"20550246";"UMI";"UMI";"The Journal of the Acoustical Society of America";0;2010;"Optical Bragg imaging of acoustic fields after reflection.";"Bragg diffraction of x-rays occurs when the rays interact with a crystalline lattice at the appropriate angle. Bragg diffraction of visible light occurs when the light interacts at the Bragg angle with an ultrasonic field of the appropriate frequency. (The spacing between acoustic condensations and rarefactions acts like the planes in an atomic lattice.) If a beam of light is Bragg diffracted by an ultrasonic beam that previously has passed through an object, an image of the structure of the object is made visible in the diffraction field of the optical beam since there is a one-to-one mapping of the ultrasonic field onto the diffraction order. In many acoustic Bragg imaging applications, the sound field must pass through the object which is to be imaged. Ultrasonic attenuation at the very high acoustic frequencies needed for Bragg imaging (typically approximately 25-30 MHz) severely limits the nondestructive testing (NDT) applications of traditional acoustic Bragg imaging. In this paper, a reflection-based application of acoustic Bragg imaging is discussed which may have useful industrial and biomedical NDT applications."
"20549916";"UMI";"UMI";"Research and theory for nursing practice";0;2010;"Out of the black box: expansion of a theory-based intervention to self-manage the uncertainty associated with active surveillance (AS) for prostate cancer.";"Active surveillance (AS) (sometimes referred to as watchful waiting) is an alternative approach to managing low-risk forms of prostate cancer. This management approach allows men to avoid expensive prostate cancer treatments and their well-documented adverse events of erectile dysfunction and incontinence. However, AS is associated with illness uncertainty and reduced quality of life (QOL; Wallace, 2003). An uncertainty management intervention (UMI) was developed by Mishel et al. (2002) to manage uncertainty in women treated for breast cancer and men treated for prostate cancer. However, the UMI was not developed for men undergoing AS for prostate cancer and has not been adequately tested in this population. This article reports on the expansion of a theory-based intervention to manage the uncertainty associated with AS for prostate cancer. Intervention Theory (Sidani &amp; Braden, 1998) is discussed as a framework for revising the UMI intervention for men undergoing AS for prostate cancer (UMI-AS). The article concludes with plans for testing of the expanded intervention and implications for the extended theory."
"20548371";"UMI";"UMI";"Optics letters";0;2010;"Spectrally efficient multiplexing of chaotic light.";"We numerically demonstrate multiplexing and demultiplexing of two distinct chaotic optical signals with strongly overlapped spectra, which are generated by mutually coupled external-cavity semiconductor lasers. Demultiplexing is performed by complete chaos synchronization, while the lasers at the receiving end are optically injected with the same multiplexed signal that couples the emitters together. Such a configuration could lead to spectrally efficient chaos-based optical encryption and decryption of multiple data streams."
"20365256";"UMI";"UMI";"Physical review. E, Statistical, nonlinear, and soft matter physics";0;2010;"Multiplexed encryption using chaotic systems with multiple stochastic-delayed feedbacks.";"We propose an efficient and fast bit-multiplexed encryption scheme exploiting hyperchaotic regimes of a single nonlinear oscillator with multiple time-delay feedback loops. Each data stream is encrypted by digitally modulating the values of the various time delays and decrypted using chaos synchronization and cross-correlation measurements. We have numerically applied our approach to an optoelectronic chaotic oscillator based on standard semiconductor lasers subjected to multiple feedbacks and have demonstrated successful data transmission and recovery between multiple users at several Gbits/s on a single communication channel."
"20199933";"UMI";"UMI";"IEEE transactions on bio-medical engineering";0;2010;"Automatic area classification in peripheral blood smears.";"Cell enumeration and diagnosis using peripheral blood smears are routine tasks in many biological and pathological examinations. Not every area in the smear is appropriate for such tasks due to severe cell clumping or sparsity. Manual working-area selection is slow, subjective, inconsistent, and statistically biased. Automatic working-area classification can reproducibly identify appropriate working smear areas. However, very little research has been reported in the literature. With the aim of providing a preprocessing step for further detailed cell enumeration and diagnosis for high-throughput screening (HTS), we propose an integrated algorithm for area classification and quantify both cell spreading and cell clumping in terms of individual clumps and the occurrence probabilities of the group of clumps over the image. Comprehensive comparisons are presented to compare the effect of these quantifications and their combinations. Our experiments using images of Giemsa-stained blood smears show that the method is efficient, accurate (above 88.9% hit rates for all areas in the validation set of 140 images), and robust (above 78.1% hit rates for a test set of 4878 images). This lays a good foundation for fast working-area selection in HTS."
"20139808";"UMI";"UMI";"Spine";0;2010;"How does surgery affect sexual desire and activities in patients with lumbar disc herniation?";"STUDY DESIGN: A retrospective survey using privacy-conscious questionnaires.OBJECTIVE: To determine the quality and frequency of sexual activities in patients with lumbar disc herniation before and after surgery.SUMMARY OF BACKGROUND DATA: Patients and health care professionals often hesitate to talk about the effects of disease, illness, or surgery on sexuality, but it is imperative that sexuality issues be addressed.METHODS: Of 90 consecutive patients, 64 who had surgically-treated lumbar disc herniation participated in this survey after informed consent. There were 43 males and 21 females with mean age of 36 years. Duration of symptom was averaged 42 weeks. The patients were asked to complete questionnaires concerning sexual desire, activity, adjustment, and satisfaction. About 83% of the patients had sexual desire, and 89% achieved satisfaction during sexual activities in presick period.RESULTS: Lumbar disc herniation decreased sexual desire in 50% and frequency of sexual activity in 59% of the patients. About 67% of males and 81% of females felt discomfort during sexual activity; satisfaction decreased in 28% of male and 41% of females. Adjustment in sexual position was required in 54% of males and 86% of females. Surgery improved sexual desire, frequency of sexual activity, and satisfaction in 85%, 88%, and 94%, respectively. However, 31% of females did not regain sexual desire and 46% still felt discomfort during sexual activity (the rates were 7% and 17% in males, respectively). Sexual activity was resumed within 2 postoperative weeks in 23% (27% in males and 14% in females), and 4 weeks in 53%. Males resumed sexual activity earlier than females.CONCLUSION: Lumbar disc herniation largely impacted sexual desire, activity, and satisfaction. Adjustment in sexual position was required in large number of patients to avoid discomfort during sexual activities. Surgical treatment improved quality of sexual activities, but more females did not regain sexual desire, felt sexual discomfort, and thereby resumed sexual activities later than males after surgery."
"19523902";"UMI";"UMI";"Structure (London, England : 1993)";42;2009;"A crescent-shaped ALIX dimer targets ESCRT-III CHMP4 filaments.";"ALIX recruits ESCRT-III CHMP4 and is involved in membrane remodeling during endosomal receptor sorting, budding of some enveloped viruses, and cytokinesis. We show that ALIX dimerizes via the middle domain (ALIX(-V)) in solution. Structural modeling based on small angle X-ray scattering (SAXS) data reveals an elongated crescent-shaped conformation for dimeric ALIX lacking the proline-rich domain (ALIX(BRO1-V)). Mutations at the dimerization interface prevent dimerization and induce an open elongated monomeric conformation of ALIX(-V) as determined by SAXS modeling. ALIX dimerizes in vivo and dimeric ALIX colocalizes with CHMP4B upon coexpression. We show further that ALIX dimerization affects HIV-1 budding. C-terminally truncated activated CHMP4B retaining the ALIX binding site forms linear, circular, and helical filaments in vitro, which can be bridged by ALIX. Our data suggest that dimeric ALIX represents the active form that interacts with ESCRT-III CHMP4 polymers and functions as a scaffolding protein during membrane remodeling processes."
