"PMID";"Method";"Search_Term";"Journal";"Citations";"YearPubmed";"Title";"Abstract"
"23966880";"3C";"(3C AND chromosome)";"PLoS Genet";5;2013;"A role for CF1A 3' end processing complex in promoter-associated transcription.";"The Cleavage Factor 1A (CF1A) complex, which is required for the termination of transcription in budding yeast, occupies the 3' end of transcriptionally active genes. We recently demonstrated that CF1A subunits also crosslink to the 5' end of genes during transcription. The presence of CF1A complex at the promoter suggested its possible involvement in the initiation/reinitiation of transcription. To check this possibility, we performed transcription run-on assay, RNAP II-density ChIP and strand-specific RT-PCR analysis in a mutant of CF1A subunit Clp1. As expected, RNAP II read through the termination signal in the temperature-sensitive mutant of clp1 at elevated temperature. The transcription readthrough phenotype was accompanied by a decrease in the density of RNAP II in the vicinity of the promoter region. With the exception of TFIIB and TFIIF, the recruitment of the general transcription factors onto the promoter, however, remained unaffected in the clp1 mutant. These results suggest that the CF1A complex affects the recruitment of RNAP II onto the promoter for reinitiation of transcription. Simultaneously, an increase in synthesis of promoter-initiated divergent antisense transcript was observed in the clp1 mutant, thereby implicating CF1A complex in providing directionality to the promoter-bound polymerase. Chromosome Conformation Capture (3C) analysis revealed a physical interaction of the promoter and terminator regions of a gene in the presence of a functional CF1A complex. Gene looping was completely abolished in the clp1 mutant. On the basis of these results, we propose that the CF1A-dependent recruitment of RNAP II onto the promoter for reinitiation and the regulation of directionality of promoter-associated transcription are accomplished through gene looping."
"24065355";"3C";"(3C AND chromosome)";"J Med Genet";4;2013;"A novel mutation in KIAA0196: identification of a gene involved in Ritscher-Schinzel/3C syndrome in a First Nations cohort.";"BACKGROUND: Ritscher-Schinzel syndrome (RSS) is a clinically heterogeneous disorder characterised by distinctive craniofacial features in addition to cerebellar and cardiac anomalies. It has been described in different populations and is presumed to follow autosomal recessive inheritance. In an effort to identify the underlying genetic cause of RSS, affected individuals from a First Nations (FN) community in northern Manitoba, Canada, were enrolled in this study.METHODS: Homozygosity mapping by SNP array and Sanger sequencing of the candidate genes in a 1Mb interval on chromosome 8q24.13 were performed on genomic DNA from eight FN RSS patients, eight of their parents and five unaffected individuals (control subjects) from this geographic isolate.RESULTS: All eight patients were homozygous for a novel splice site mutation in KIAA0196. RNA analysis revealed an approximate eightfold reduction in the relative amount of a KIAA0196 transcript lacking exon 27. A 60% reduction in the amount of strumpellin protein was observed on western blot.CONCLUSIONS: We have identified a mutation in KIAA0196 as the cause of the form of RSS characterised in our cohort. The ubiquitous expression and highly conserved nature of strumpellin, the product of KIAA0196, is consistent with the complex and multisystem nature of this disorder."
"23555968";"3C";"(3C AND chromosome)";"PLoS One";4;2013;"Actual ligation frequencies in the chromosome conformation capture procedure.";"Chromosome conformation capture (3C) and derivative experimental procedures are used to estimate the spatial proximity between different genomic elements, thus providing information about the 3D organization of genomic domains and whole genomes within the nucleus. All C-methods are based on the proximity ligation-the preferential ligation of joined DNA fragments obtained upon restriction enzyme digestion of in vivo cross-linked chromatin. Here, using the mouse beta-globin genes in erythroid cells as a model, we estimated the actual frequencies of ligation between the fragments bearing the promoter of the major beta-globin gene and its distant enhancers and showed that the number of ligation products produced does not exceed 1% of all fragments subjected to the ligation. Although this low yield of 3C ligation products may be explained entirely by technical issues, it may as well reflect a low frequency of interaction between DNA regulatory elements in vivo."
"24369423";"3C";"(3C AND chromosome)";"Nucleic Acids Res";3;2013;"Quantitative analysis of genomic element interactions by molecular colony technique.";"Distant genomic elements were found to interact within the folded eukaryotic genome. However, the used experimental approach (chromosome conformation capture, 3C) enables neither determination of the percentage of cells in which the interactions occur nor demonstration of simultaneous interaction of &gt;2 genomic elements. Each of the above can be done using in-gel replication of interacting DNA segments, the technique reported here. Chromatin fragments released from formaldehyde-cross-linked cells by sodium dodecyl sulfate extraction and sonication are distributed in a polyacrylamide gel layer followed by amplification of selected test regions directly in the gel by multiplex polymerase chain reaction. The fragments that have been cross-linked and separate fragments give rise to multi- and monocomponent molecular colonies, respectively, which can be distinguished and counted. Using in-gel replication of interacting DNA segments, we demonstrate that in the material from mouse erythroid cells, the majority of fragments containing the promoters of active β-globin genes and their remote enhancers do not form complexes stable enough to survive sodium dodecyl sulfate extraction and sonication. This indicates that either these elements do not interact directly in the majority of cells at a given time moment, or the formed DNA-protein complex cannot be stabilized by formaldehyde cross-linking."
"24244182";"3C";"(3C AND chromosome)";"PLoS Genet";3;2013;"Transposable prophage Mu is organized as a stable chromosomal domain of E. coli.";"The E. coli chromosome is compacted by segregation into 400-500 supercoiled domains by both active and passive mechanisms, for example, transcription and DNA-protein association. We find that prophage Mu is organized as a stable domain bounded by the proximal location of Mu termini L and R, which are 37 kbp apart on the Mu genome. Formation/maintenance of the Mu 'domain' configuration, reported by Cre-loxP recombination and 3C (chromosome conformation capture), is dependent on a strong gyrase site (SGS) at the center of Mu, the Mu L end and MuB protein, and the E. coli nucleoid proteins IHF, Fis and HU. The Mu domain was observed at two different chromosomal locations tested. By contrast, prophage λ does not form an independent domain. The establishment/maintenance of the Mu domain was promoted by low-level transcription from two phage promoters, one of which was domain dependent. We propose that the domain confers transposition readiness to Mu by fostering topological requirements of the reaction and the proximity of Mu ends. The potential benefits to the host cell from a subset of proteins expressed by the prophage may in turn help its long-term stability."
"24195706";"3C";"(3C AND chromosome)";"J Comput Biol";3;2013;"3D chromosome modeling with semi-definite programming and Hi-C data.";"For a long period of time, scientists studied genomes while assuming they are linear. Recently, chromosome conformation capture (3C)-based technologies, such as Hi-C, have been developed that provide the loci contact frequencies among loci pairs in a genome-wide scale. The technology unveiled that two far-apart loci can interact in the tested genome. It indicated that the tested genome forms a three-dimensional (3D) chromosomal structure within the nucleus. With the available Hi-C data, our next challenge is to model the 3D chromosomal structure from the 3C-derived data computationally. This article presents a deterministic method called ChromSDE, which applies semi-definite programming techniques to find the best structure fitting the observed data and uses golden section search to find the correct parameter for converting the contact frequency to spatial distance. Further, we develop a measure called consensus index to indicate if the Hi-C data corresponds to a single structure or a mixture of structures. To the best of our knowledge, ChromSDE is the only method that can guarantee recovering the correct structure in the noise-free case. In addition, we prove that the parameter of conversion from contact frequency to spatial distance will change under different resolutions theoretically and empirically. Using simulation data and real Hi-C data, we showed that ChromSDE is much more accurate and robust than existing methods. Finally, we demonstrated that interesting biological findings can be uncovered from our predicted 3D structure."
"24071518";"3C";"(3C AND chromosome)";"Mol Cell Endocrinol";3;2013;"Estrogen receptor-mediated long-range chromatin interactions and transcription in breast cancer.";"Estrogen induces the binding of ERα to thousands of locations in the breast cancer genome, preferring intergenic and distal regions rather than near the promoters of estrogen-regulated genes. With recent technological innovations in mapping and characterization of global chromatin organization, evidence now indicates ERα mediates long-range chromatin interactions to control gene transcription. The principles that govern how ERα communicates with their putative target genes via chromosomal interactions are also beginning to unravel. Herein, we summarize our current knowledge on the functional significance of chromatin looping in estrogen-mediated transcription. ERα collaborative factors and other players that contribute to define the genomic interactions in breast cancer cells will also be discussed. Defects in chromatin organization are emerging key players in diseases such as cancer, thus understanding how ERα-mediated chromatin looping affects genome organization will clarify the receptor's role in estrogen responsive pathways sensitive to defects in chromatin organization."
"24051548";"3C";"(3C AND chromosome)";"Nucleus";3;2013;"The statistical-mechanics of chromosome conformation capture.";"Since Jacob and Monod's characterization of the role of DNA elements in gene control, it has been recognized that the linear organization of genome structure is important for the regulation of gene transcription and hence the manifestation of phenotypes. Similarly, it has long been hypothesized that the spatial organization (in three dimensions evolving through time), as part of the epigenome, makes a significant contribution to the genotype-phenotype transition. Proximity ligation assays commonly known as chromosome conformation capture (3C) and 3C based methodologies (e.g., GCC, HiC and ChIA-Pet) are increasingly being incorporated into empirical studies to investigate the role that three-dimensional genome structure plays in the regulation of phenotype. The apparent simplicity of these methodologies-crosslink chromatin, digest, dilute, ligate, detect interactions-belies the complexity of the data and the considerations that should be taken into account to ensure the generation and accurate interpretation of reliable data. Here we discuss the probabilistic nature of these methodologies and how this contributes to their endogenous limitations."
"24014450";"3C";"(3C AND chromosome)";"Wiley Interdiscip Rev Dev Biol";3;2013;"Chromatin looping and organization at developmentally regulated gene loci.";"Developmentally regulated genes are often controlled by distant enhancers, silencers and insulators, to implement their correct transcriptional programs. In recent years, the development of 3C and derived techniques (4C, 5C, HiC, ChIA-PET, etc.) has confirmed that chromatin looping is an important mechanism for the transfer of regulatory information in mammalian cells. At many developmentally regulated gene loci, transcriptional activation is indeed accompanied by the formation of chromatin loops between genes and distant enhancers. Similarly, dynamic looping between insulator elements and changes in local 3D organization may be observed upon variation in transcriptional activity. Chromatin looping also occurs at silent gene loci, where its function remains less understood. In lineage-committed cells, partial 3D configurations are detected at loci that are activated at later stages. However, these partial configurations usually lack promoter-enhancer loops that accompany transcriptional activation, suggesting they have structural functions. Definitive evidence for a repressive role of chromatin looping is still lacking. Chromatin loops have been reported at repressed loci but, alternatively, they may act as a distraction for active loops. Together, these mechanisms allow fine-tuning of regulatory programs, thus providing further diversity in the transcriptional control of developmentally regulated gene loci."
"23861668";"3C";"(3C AND chromosome)";"PLoS Genet";3;2013;"Effective blocking of the white enhancer requires cooperation between two main mechanisms suggested for the insulator function.";"Chromatin insulators block the action of transcriptional enhancers when interposed between an enhancer and a promoter. In this study, we examined the role of chromatin loops formed by two unrelated insulators, gypsy and Fab-7, in their enhancer-blocking activity. To test for this activity, we selected the white reporter gene that is activated by the eye-specific enhancer. The results showed that one copy of the gypsy or Fab-7 insulator failed to block the eye enhancer in most of genomic sites, whereas a chromatin loop formed by two gypsy insulators flanking either the eye enhancer or the reporter completely blocked white stimulation by the enhancer. However, strong enhancer blocking was achieved due not only to chromatin loop formation but also to the direct interaction of the gypsy insulator with the eye enhancer, which was confirmed by the 3C assay. In particular, it was observed that Mod(mdg4)-67.2, a component of the gypsy insulator, interacted with the Zeste protein, which is critical for the eye enhancer-white promoter communication. These results suggest that efficient enhancer blocking depends on the combination of two factors: chromatin loop formation by paired insulators, which generates physical constraints for enhancer-promoter communication, and the direct interaction of proteins recruited to an insulator and to the enhancer-promoter pair."
"23607989";"3C";"(3C AND chromosome)";"Biochim Biophys Acta";2;2013;"Histone acetylation contributes to chromatin looping between the locus control region and globin gene by influencing hypersensitive site formation.";"Chromatin loops are formed between enhancers and promoters and between insulators to regulate gene transcription in the eukaryotic genome. These transcription regulatory elements forming loops have highly acetylated histones. To understand the correlation between histone acetylation and chromatin loop formation, we inhibited the expression of histone acetyltransferase CBP and p300 in erythroid K562 cells and analyzed the chromatin structure of the β-globin locus. The proximity between the locus control region (LCR) and the active (G)γ-globin gene was decreased in the β-globin locus when histones were hypoacetylated by the double knockdown of CBP and p300. Sensitivity to DNase I and binding of erythroid specific activators were reduced in the hypoacetylated LCR hypersensitive sites (HSs) and gene promoter. Interestingly, the chromatin loop between HS5 and 3'HS1 was formed regardless of the hypoacetylation of the β-globin locus. CTCF binding was maintained at HS5 and 3'HS1 in the hypoacetylated locus. Thus, these results indicate that histone acetylation contributes to chromatin looping through the formation of HSs in the LCR and gene promoter. However, looping between insulators appears to be independent from histone acetylation."
"23390487";"3C";"(3C AND chromosome)";"PLoS One";2;2013;"Regulatory elements associated with paternally-expressed genes in the imprinted murine Angelman/Prader-Willi syndrome domain.";"The Angelman/Prader-Willi syndrome (AS/PWS) domain contains at least 8 imprinted genes regulated by a bipartite imprinting center (IC) associated with the SNRPN gene. One component of the IC, the PWS-IC, governs the paternal epigenotype and expression of paternal genes. The mechanisms by which imprinting and expression of paternal genes within the AS/PWS domain - such as MKRN3 and NDN - are regulated by the PWS-IC are unclear. The syntenic region in the mouse is organized and imprinted similarly to the human domain with the murine PWS-IC defined by a 6 kb interval within the Snrpn locus that includes the promoter. To identify regulatory elements that may mediate PWS-IC function, we mapped the location and allele-specificity of DNase I hypersensitive (DH) sites within the PWS-IC in brain cells, then identified transcription factor binding sites within a subset of these DH sites. Six major paternal-specific DH sites were detected in the Snrpn gene, five of which map within the 6 kb PWS-IC. We postulate these five DH sites represent functional components of the murine PWS-IC. Analysis of transcription factor binding within multiple DH sites detected nuclear respiratory factors (NRF's) and YY1 specifically on the paternal allele. NRF's and YY1 were also detected in the paternal promoter region of the murine Mrkn3 and Ndn genes. These results suggest that NRF's and YY1 may facilitate PWS-IC function and coordinately regulate expression of paternal genes. The presence of NRF's also suggests a link between transcriptional regulation within the AS/PWS domain and regulation of respiration. 3C analyses indicated Mkrn3 lies in close proximity to the PWS-IC on the paternal chromosome, evidence that the PWS-IC functions by allele-specific interaction with its distal target genes. This could occur by allele-specific co-localization of the PWS-IC and its target genes to transcription factories containing NRF's and YY1."
"24098740";"3C";"(3C AND chromosome)";"PLoS One";1;2013;"Dynamic trans interactions in yeast chromosomes.";"Three-dimensional organization of the genome is important for regulation of gene expression and maintenance of genomic stability. It also defines, and is defined by, contacts between different chromosomal loci. Interactions between loci positioned on different chromosomes, i.e. &quot;trans&quot; interactions are one type of such contacts. Here, we describe a case of inducible trans interaction in chromosomes of the budding yeast S. cerevisiae. Special DNA sequences, inserted in two ectopic chromosomal loci positioned in trans, pair with one another in an inducible manner. The spatial proximity diagnostic of pairing is observable by both chromosome capture analysis (3C) and epifluorescence microscopy in whole cells. Protein synthesis de novo appears to be required for this process. The three-dimensional organization of the yeast nucleus imposes a constraint on such pairing, presumably by dictating the probability with which the two sequences collide with one another."
"24069388";"3C";"(3C AND chromosome)";"PLoS One";1;2013;"NuChart: an R package to study gene spatial neighbourhoods with multi-omics annotations.";"Long-range chromosomal associations between genomic regions, and their repositioning in the 3D space of the nucleus, are now considered to be key contributors to the regulation of gene expression and important links have been highlighted with other genomic features involved in DNA rearrangements. Recent Chromosome Conformation Capture (3C) measurements performed with high throughput sequencing (Hi-C) and molecular dynamics studies show that there is a large correlation between colocalization and coregulation of genes, but these important researches are hampered by the lack of biologists-friendly analysis and visualisation software. Here, we describe NuChart, an R package that allows the user to annotate and statistically analyse a list of input genes with information relying on Hi-C data, integrating knowledge about genomic features that are involved in the chromosome spatial organization. NuChart works directly with sequenced reads to identify the related Hi-C fragments, with the aim of creating gene-centric neighbourhood graphs on which multi-omics features can be mapped. Predictions about CTCF binding sites, isochores and cryptic Recombination Signal Sequences are provided directly with the package for mapping, although other annotation data in bed format can be used (such as methylation profiles and histone patterns). Gene expression data can be automatically retrieved and processed from the Gene Expression Omnibus and ArrayExpress repositories to highlight the expression profile of genes in the identified neighbourhood. Moreover, statistical inferences about the graph structure and correlations between its topology and multi-omics features can be performed using Exponential-family Random Graph Models. The Hi-C fragment visualisation provided by NuChart allows the comparisons of cells in different conditions, thus providing the possibility of novel biomarkers identification. NuChart is compliant with the Bioconductor standard and it is freely available at ftp://fileserver.itb.cnr.it/nuchart."
"24370013";"3C";"(3C AND chromosome)";"Zhongguo Shi Yan Xue Ye Xue Za Zhi";0;2013;"[Unraveling the chromosome higher-order structures in the transcriptional regulation of hematopoiesis by chromosome conformation capture].";"Emerging evidence has demonstrated that genomes are organized into higher-order structures in vivo and long range interactions between genomic regions largely contribute to the regulation of gene expression. Hematopoiesis, orchestrated by the precise spatial regulation and organization of hematopoietic transcription factors, serves as a good model for exploring these issues. The chromosome conformation capture (3C) methodology and its high throughput based technology provide an innovative solution for analyzing the regulation of functional elements through inter-chromosomal and intra-chromosomal interactions, and contacts of functional components in nuclei, thus leading to a more comprehensive understanding of human genome and gene expression. This review focuses on the recent progress of 3C and its derivatives, and their applications in unraveling the mechanisms of transcriptional regulation in hematopoiesis."
"24256267";"3C";"(3C AND chromosome)";"Biochem Soc Trans";0;2013;"The links between chromatin spatial organization and biological function.";"During the last few years, there has been a rapid increase in our knowledge of how chromatin is organized inside the nucleus. Techniques such as FISH (fluorescence in situ hybridization) have proved that chromosomes organize themselves in so-called CTs (chromosome territories). In addition, newly developed 3C (chromatin conformation capture) techniques have revealed that certain chromosomal regions tend to interact with adjacent regions on either the same chromosome or adjacent chromosomes, and also that regions in close proximity are replicated simultaneously. Furthermore, transcriptionally repressed or active areas occupy different nuclear compartments. Another new technique, named DamID (DNA adenine methyltransferase identification), has strengthened the notion that transcriptionally repressed genes are often found in close association with the nuclear membrane, whereas transcriptionally active regions are found in the more central regions of the nucleus. However, in response to various stimuli, transcriptionally repressed regions are known to relocalize from the nuclear lamina to the interior of the nucleus, leading to a concomitant up-regulation of otherwise silenced genes. Taken together, these insights are of great interest for the relationship between chromosomal spatial organization and genome function. In the present article, we review recent advances in this field with a focus on mammalian cells and the eukaryotic model organism Schizosaccharomyces pombe."
"24004655";"3C";"(3C AND chromosome)";"Pharmacol Res";0;2013;"FXR mediates a chromatin looping in the GR promoter thus promoting the resolution of colitis in rodents.";"Glucocorticoids (GCs) are important endocrine regulators of a wide range of physiological processes ranging from immune function to glucose and lipid metabolism. For decades, synthetic glucocorticoids such as dexamethasone have been the cornerstone for the clinical treatment of inflammatory bowel diseases (IBD). A previous study has shown that farnesoid X receptor (FXR) enhances the transcription of NR3C1 gene, which encodes for human GR, by binding to a conserved FXR response element (FXRE) in the distal promoter of this gene. In the present study we demonstrate that FXR promotes the resolution of colitis in rodents by enhancing Gr gene transcription. We used the chromatin conformation capture (3C) assay to demonstrate that this FXRE is functional in mediating a head-to-tail chromatin looping, thus increasing Gr transcription efficiency. These findings underscore the importance of FXR/GR axis in the control of intestinal inflammation."
